{
  "name": "Service Dashboard Snapshot",
  "goal": "Distill observability material into a build_skill for self. Seed: Service status: degraded Primary region: shanghai",
  "source_modality": "image",
  "skill_type": "procedure",
  "audience": "self",
  "trigger": [
    "Use when you need to convert image evidence into a reusable build_skill."
  ],
  "inputs": [
    "Image source",
    "Distillation goal"
  ],
  "preconditions": [
    "Confirm the source material matches the declared distillation goal."
  ],
  "steps": [
    {
      "step": 1,
      "action": "Service status: degraded Primary region: shanghai",
      "why": "Derived from normalized evidence and intended to preserve the original reasoning chain."
    },
    {
      "step": 2,
      "action": "Dashboard frame shows a degraded service banner and a latency spike.",
      "why": "Derived from normalized evidence and intended to preserve the original reasoning chain."
    }
  ],
  "decision_rules": [],
  "anti_patterns": [],
  "verification": [
    "Confirm each key conclusion can be traced back to evidence_refs.",
    "Run one manual rehearsal to verify the steps are executable."
  ],
  "evidence_refs": [
    "a1faafc1-9126-4cc8-837c-b7450a4a9ada@image:ocr:0001",
    "b5801999-2055-4f25-af05-18ca99fc1bf9@image:scene:0001"
  ],
  "confidence": 0.63,
  "version": "0.1.0",
  "summary": "Service status: degraded Primary region: shanghai",
  "tags": [
    "observability",
    "image",
    "build_skill",
    "heuristic"
  ],
  "review_status": "draft",
  "created_at": "2026-04-19T13:52:06Z",
  "skill_id": "cd0e6e8f-e817-4089-a821-f3c88c4815ad"
}
