{
  "name": "PostgreSQL Slow Query Review",
  "goal": "Distill database material into a build_skill for self. Seed: # PostgreSQL Slow Query Review",
  "source_modality": "text",
  "skill_type": "procedure",
  "audience": "self",
  "trigger": [
    "Use when you need to convert text evidence into a reusable build_skill."
  ],
  "inputs": [
    "Source document",
    "Distillation goal"
  ],
  "preconditions": [
    "Confirm the source material matches the declared distillation goal."
  ],
  "steps": [
    {
      "step": 1,
      "action": "Capture the top slow queries from pg_stat_statements.",
      "why": "Derived from normalized evidence and intended to preserve the original reasoning chain."
    },
    {
      "step": 2,
      "action": "Compare execution plans before changing indexes.",
      "why": "Derived from normalized evidence and intended to preserve the original reasoning chain."
    }
  ],
  "decision_rules": [
    "If the query is I/O bound, review the missing indexes first."
  ],
  "anti_patterns": [
    "Avoid adding overlapping indexes without measuring write amplification."
  ],
  "verification": [
    "Verify the new plan with EXPLAIN ANALYZE and compare latency."
  ],
  "evidence_refs": [
    "0efcb9a5-ca6c-4036-8507-ce4e3a6d29ea@paragraph:0001",
    "b5e13fe4-6719-43fc-aecb-2a8180b1fce5@paragraph:0002",
    "133189bf-d972-4f1a-8749-7a8fd94f12d2@paragraph:0003"
  ],
  "confidence": 0.77,
  "version": "0.1.0",
  "summary": "# PostgreSQL Slow Query Review",
  "tags": [
    "database",
    "text",
    "build_skill",
    "heuristic"
  ],
  "review_status": "draft",
  "created_at": "2026-04-20T15:00:05Z",
  "skill_id": "3339f168-9ad9-439f-8386-24c67dde9cba"
}
