{
  "name": "single text skill",
  "goal": "Distill incident_response material into a build_skill for self. Seed: # Incident Runbook 1. Rebuild the timeline. 2. Merge duplicate alerts. Verify recovery with latency and error rate.",
  "source_modality": "text",
  "skill_type": "procedure",
  "audience": "self",
  "trigger": [
    "Use when you need to convert text evidence into a reusable build_skill."
  ],
  "inputs": [
    "Source document",
    "Distillation goal"
  ],
  "preconditions": [
    "Confirm the source material matches the declared distillation goal."
  ],
  "steps": [
    {
      "step": 1,
      "action": "Rebuild the timeline.",
      "why": "Derived from normalized evidence and intended to preserve the original reasoning chain."
    },
    {
      "step": 2,
      "action": "Merge duplicate alerts.",
      "why": "Derived from normalized evidence and intended to preserve the original reasoning chain."
    }
  ],
  "decision_rules": [],
  "anti_patterns": [],
  "verification": [
    "Verify recovery with latency and error rate."
  ],
  "evidence_refs": [
    "d4adf34b-7412-4d3e-81cf-3279ba5a459a@paragraph:0001"
  ],
  "confidence": 0.59,
  "version": "0.1.0",
  "summary": "# Incident Runbook 1. Rebuild the timeline. 2. Merge duplicate alerts. Verify recovery with latency and error rate.",
  "tags": [
    "incident_response",
    "text",
    "build_skill",
    "heuristic"
  ],
  "review_status": "draft",
  "created_at": "2026-04-20T14:13:01Z",
  "skill_id": "a9b171ef-84f7-4079-a63c-be5b4dd65821"
}
