{
  "name": "Incident Debrief",
  "goal": "Distill ops material into a build_skill for self. Seed: 1. Rebuild the incident timeline.",
  "source_modality": "audio",
  "skill_type": "decision",
  "audience": "self",
  "trigger": [
    "Use when you need to convert audio evidence into a reusable build_skill."
  ],
  "inputs": [
    "Audio source or transcript",
    "Distillation goal"
  ],
  "preconditions": [
    "Confirm the source material matches the declared distillation goal."
  ],
  "steps": [
    {
      "step": 1,
      "action": "Rebuild the incident timeline.",
      "why": "Derived from normalized evidence and intended to preserve the original reasoning chain."
    }
  ],
  "decision_rules": [
    "If alerts duplicate, merge them into one incident stream."
  ],
  "anti_patterns": [],
  "verification": [
    "Verify recovery with error rate and latency."
  ],
  "evidence_refs": [
    "5b6d528c-bf43-4abc-8037-98d9ee101183@timestamp:0.00-3.00",
    "b052af40-9b33-4522-b6d0-892902224164@timestamp:3.00-6.00",
    "6ee3dfd9-be9d-432e-a835-d456df553d98@timestamp:6.00-9.00"
  ],
  "confidence": 0.72,
  "version": "0.1.0",
  "summary": "1. Rebuild the incident timeline.",
  "tags": [
    "ops",
    "audio",
    "build_skill",
    "heuristic"
  ],
  "review_status": "draft",
  "created_at": "2026-04-20T15:53:13Z",
  "skill_id": "4d946c82-9edd-4c40-883e-77df9daaa333"
}
