{
  "name": "controlled trial mixed script smoke",
  "goal": "Distill controlled_trial material into a build_skill for self. Seed: Incident Postmortem (Sanitized)",
  "source_modality": "text",
  "skill_type": "procedure",
  "audience": "self",
  "trigger": [
    "Use when you need to convert text evidence into a reusable build_skill."
  ],
  "inputs": [
    "Source document",
    "Distillation goal"
  ],
  "preconditions": [
    "Confirm the source material matches the declared distillation goal."
  ],
  "steps": [
    {
      "step": 1,
      "action": "08:10 UTC: latency alert fired.",
      "why": "Derived from normalized evidence and intended to preserve the original reasoning chain."
    },
    {
      "step": 2,
      "action": "08:16 UTC: oncall confirmed row estimate mismatch.",
      "why": "Derived from normalized evidence and intended to preserve the original reasoning chain."
    },
    {
      "step": 3,
      "action": "08:28 UTC: mitigated by rollback + stats refresh.",
      "why": "Derived from normalized evidence and intended to preserve the original reasoning chain."
    },
    {
      "step": 4,
      "action": "Validate estimator accuracy before index decisions.",
      "why": "Derived from normalized evidence and intended to preserve the original reasoning chain."
    },
    {
      "step": 5,
      "action": "Keep rollout guardrails tied to latency and error-rate together.",
      "why": "Derived from normalized evidence and intended to preserve the original reasoning chain."
    }
  ],
  "decision_rules": [],
  "anti_patterns": [],
  "verification": [
    "[00:00:20] Reviewer: Confirm whether alert deduping worked during rollback.",
    "[00:02:10] Reviewer: Capture this as a runbook rule with verification checkpoints."
  ],
  "evidence_refs": [
    "38f9024b-3836-4e5e-bdc0-21854ddd6e83@section:1",
    "e3bd5b69-345e-4b17-9eb1-13bd85617454@section:1.1",
    "b90ff59a-4ca8-43b5-8060-209da92e313f@section:1.1:paragraph:0001",
    "e250565a-494b-4160-adee-ca2a5fb7d796@section:1.2",
    "c45d654b-7276-4ecb-83e3-fc35ac63fe5b@section:1.2:paragraph:0002",
    "de1422c3-cb7b-47a3-89b7-da4ede834381@section:1.3",
    "229718d7-001b-4528-abf5-7c8694a50b00@section:1.3:paragraph:0003",
    "0fe89835-010d-49e5-a58e-638e552db895@image:ocr:0001",
    "3f80041f-b4fe-4e1e-bc48-622b9dcda851@image:region:0001",
    "0aae237d-6424-4242-8ab7-6808ac2e66de@image:region:0002",
    "500f11a7-d758-42a0-b90d-483715b157b2@image:scene:0001",
    "e8dfded6-8166-47d9-a11f-7c6782e4a1b6@image:layout:0001",
    "4d4412bc-17e0-4d29-b2fe-59c438fa14d7@section:1",
    "d1bbc183-4b78-42b4-b529-1cb83c0049c3@section:1:paragraph:0001"
  ],
  "confidence": 0.9,
  "version": "0.1.0",
  "summary": "Incident Postmortem (Sanitized)",
  "tags": [
    "controlled_trial",
    "text",
    "build_skill",
    "heuristic"
  ],
  "review_status": "draft",
  "created_at": "2026-05-21T06:09:56Z",
  "skill_id": "4f4a3be7-3461-4645-8fa6-7809128a40ff"
}
