{
  "name": "PostgreSQL Slow Query Review",
  "goal": "Distill database material into a build_skill for self. Seed: # PostgreSQL Slow Query Review",
  "source_modality": "text",
  "skill_type": "procedure",
  "audience": "self",
  "trigger": [
    "Use when you need to convert text evidence into a reusable build_skill."
  ],
  "inputs": [
    "Source document",
    "Distillation goal"
  ],
  "preconditions": [
    "This note captures a repeatable way to review slow SQL queries before blindly adding indexes.",
    "If the query is I/O bound, review index coverage before rewriting business logic."
  ],
  "steps": [
    {
      "step": 1,
      "action": "Capture the worst queries from `pg_stat_statements`.",
      "why": "Derived from normalized evidence and intended to preserve the original reasoning chain."
    },
    {
      "step": 2,
      "action": "Run `EXPLAIN ANALYZE` and compare the actual plan with the expected access path.",
      "why": "Derived from normalized evidence and intended to preserve the original reasoning chain."
    },
    {
      "step": 3,
      "action": "Measure whether the bottleneck is I/O, CPU, or lock contention.",
      "why": "Derived from normalized evidence and intended to preserve the original reasoning chain."
    }
  ],
  "decision_rules": [
    "If row estimates diverge sharply from actual rows, inspect stale statistics."
  ],
  "anti_patterns": [
    "Avoid adding overlapping indexes without calculating write amplification.",
    "Do not change the query text and the index strategy at the same time."
  ],
  "verification": [
    "Verify the fix by comparing latency, buffer hits, and row estimates before and after the change."
  ],
  "evidence_refs": [
    "6cae9ba1-163e-498c-9da7-f48a25970f21@paragraph:0001",
    "268be78c-ae37-404c-a034-eee8e51b989e@paragraph:0002",
    "eca307f4-03b7-4b19-98a4-005193a51f59@paragraph:0003",
    "c8151765-7814-4249-97c8-0123a37a57f8@paragraph:0004",
    "02ede0a9-df09-4c8d-8492-a3b3cd9a92df@paragraph:0005",
    "b6524d0c-f80f-4acf-91ad-c3e2c203fb57@paragraph:0006",
    "943263ef-7bef-4e6a-afaf-d3ec5c75b527@paragraph:0007",
    "45459108-9ae6-476a-9189-974270edfcb1@paragraph:0008",
    "9f91859e-c935-4faa-af4e-2753ec3d33e3@paragraph:0009",
    "7b15af7d-bd94-4b12-a01a-dc6fd89ee0ad@paragraph:0010",
    "e251141a-4595-4797-b94d-9159f6e02ff0@paragraph:0011"
  ],
  "confidence": 0.95,
  "version": "0.1.0",
  "summary": "# PostgreSQL Slow Query Review",
  "tags": [
    "database",
    "text",
    "build_skill",
    "heuristic"
  ],
  "review_status": "draft",
  "created_at": "2026-04-20T12:06:06Z",
  "skill_id": "7b85a2ed-ceb0-449d-b4df-3de31bfa4ca5"
}
