{
  "name": "single text skill",
  "goal": "Distill incident_response material into a build_skill for self. Seed: Incident Runbook",
  "source_modality": "text",
  "skill_type": "procedure",
  "audience": "self",
  "trigger": [
    "Use when you need to convert text evidence into a reusable build_skill."
  ],
  "inputs": [
    "Source document",
    "Distillation goal"
  ],
  "preconditions": [
    "Confirm the source material matches the declared distillation goal."
  ],
  "steps": [
    {
      "step": 1,
      "action": "Rebuild the timeline.",
      "why": "Derived from normalized evidence and intended to preserve the original reasoning chain."
    },
    {
      "step": 2,
      "action": "Merge duplicate alerts.",
      "why": "Derived from normalized evidence and intended to preserve the original reasoning chain."
    }
  ],
  "decision_rules": [],
  "anti_patterns": [],
  "verification": [
    "Verify recovery with latency and error rate."
  ],
  "evidence_refs": [
    "19b32340-7769-4ad1-881d-c929dfbdd25a@section:1",
    "910914c5-0689-4451-b986-cade524bf0e4@section:1:paragraph:0001"
  ],
  "confidence": 0.63,
  "version": "0.1.0",
  "summary": "Incident Runbook",
  "tags": [
    "incident_response",
    "text",
    "build_skill",
    "heuristic"
  ],
  "review_status": "draft",
  "created_at": "2026-04-20T15:45:17Z",
  "skill_id": "4bd7b456-2bb0-430a-a15d-5d5a70ae9058"
}
