{
  "name": "PostgreSQL Slow Query Review",
  "goal": "Distill database material into a build_skill for self. Seed: # PostgreSQL Slow Query Review",
  "source_modality": "text",
  "skill_type": "procedure",
  "audience": "self",
  "trigger": [
    "Use when you need to convert text evidence into a reusable build_skill."
  ],
  "inputs": [
    "Source document",
    "Distillation goal"
  ],
  "preconditions": [
    "This note captures a repeatable way to review slow SQL queries before blindly adding indexes.",
    "If the query is I/O bound, review index coverage before rewriting business logic."
  ],
  "steps": [
    {
      "step": 1,
      "action": "Capture the worst queries from `pg_stat_statements`.",
      "why": "Derived from normalized evidence and intended to preserve the original reasoning chain."
    },
    {
      "step": 2,
      "action": "Run `EXPLAIN ANALYZE` and compare the actual plan with the expected access path.",
      "why": "Derived from normalized evidence and intended to preserve the original reasoning chain."
    },
    {
      "step": 3,
      "action": "Measure whether the bottleneck is I/O, CPU, or lock contention.",
      "why": "Derived from normalized evidence and intended to preserve the original reasoning chain."
    }
  ],
  "decision_rules": [
    "If row estimates diverge sharply from actual rows, inspect stale statistics."
  ],
  "anti_patterns": [
    "Avoid adding overlapping indexes without calculating write amplification.",
    "Do not change the query text and the index strategy at the same time."
  ],
  "verification": [
    "Verify the fix by comparing latency, buffer hits, and row estimates before and after the change."
  ],
  "evidence_refs": [
    "2c13daad-4b7b-472d-b392-e56f92660bb7@paragraph:0001",
    "ad5df780-f101-4de3-9a8d-331d79c5f39a@paragraph:0002",
    "e99975e5-1457-4958-b760-e422e24620c3@paragraph:0003",
    "89649571-0e2e-4773-a42a-787c61a71e8b@paragraph:0004",
    "117420a9-9b19-4189-8664-e711c03b7207@paragraph:0005",
    "eb4db591-cc97-4e2d-b994-1bf78250830b@paragraph:0006",
    "616e1a80-bfa1-416c-929a-bdd0c5752dfc@paragraph:0007",
    "4634db72-def8-414f-9a5d-e0f691060336@paragraph:0008",
    "a9457bf8-9364-42d4-ab82-2db14fcc36e8@paragraph:0009",
    "b031dbc7-63dc-4d16-8de4-19a5286774b7@paragraph:0010",
    "f7b9f626-437d-4cf9-b470-e4660a0dcc1d@paragraph:0011"
  ],
  "confidence": 0.95,
  "version": "0.1.0",
  "summary": "# PostgreSQL Slow Query Review",
  "tags": [
    "database",
    "text",
    "build_skill"
  ],
  "review_status": "draft",
  "created_at": "2026-04-19T13:02:09Z",
  "skill_id": "9d1d59b6-ae5f-4570-9864-fb1c6b86f8cd"
}
