{
  "name": "Incident Debrief",
  "goal": "Distill ops material into a build_skill for self. Seed: 1. Rebuild the incident timeline.",
  "source_modality": "audio",
  "skill_type": "decision",
  "audience": "self",
  "trigger": [
    "Use when you need to convert audio evidence into a reusable build_skill."
  ],
  "inputs": [
    "Audio source or transcript",
    "Distillation goal"
  ],
  "preconditions": [
    "Confirm the source material matches the declared distillation goal."
  ],
  "steps": [
    {
      "step": 1,
      "action": "Rebuild the incident timeline.",
      "why": "Derived from normalized evidence and intended to preserve the original reasoning chain."
    }
  ],
  "decision_rules": [
    "If alerts duplicate, merge them into one incident stream."
  ],
  "anti_patterns": [],
  "verification": [
    "Verify recovery with error rate and latency."
  ],
  "evidence_refs": [
    "c860bbaf-556b-460b-9368-51914e9fb228@timestamp:0.00-3.00",
    "9f31c898-fff0-460e-b6f9-a85d516a5aee@timestamp:3.00-6.00",
    "a2ffb79a-90e5-430d-9ac2-416f2d64b36a@timestamp:6.00-9.00"
  ],
  "confidence": 0.72,
  "version": "0.1.0",
  "summary": "1. Rebuild the incident timeline.",
  "tags": [
    "ops",
    "audio",
    "build_skill",
    "heuristic"
  ],
  "review_status": "draft",
  "created_at": "2026-04-20T12:31:18Z",
  "skill_id": "98b75527-4317-44d0-aa00-43df811ce672"
}
