{
  "name": "demo video",
  "goal": "Distill incident_response material into a build_skill for self. Seed: krvce JegrMed 'mpon shanghr Mt1an h1overrea0trarc",
  "source_modality": "video",
  "skill_type": "procedure",
  "audience": "self",
  "trigger": [
    "Use when you need to convert video evidence into a reusable build_skill."
  ],
  "inputs": [
    "Video source",
    "Distillation goal",
    "Keyframe/OCR evidence"
  ],
  "preconditions": [
    "Confirm the source material matches the declared distillation goal."
  ],
  "steps": [
    {
      "step": 1,
      "action": "krvce JegrMed 'mpon shanghr Mt1an h1overrea0trarc",
      "why": "Derived from normalized evidence and intended to preserve the original reasoning chain."
    },
    {
      "step": 2,
      "action": "krvce degraded 'mpon shanghr Mt1an fa1overreadtmffc",
      "why": "Derived from normalized evidence and intended to preserve the original reasoning chain."
    }
  ],
  "decision_rules": [],
  "anti_patterns": [],
  "verification": [
    "Confirm each key conclusion can be traced back to evidence_refs.",
    "Run one manual rehearsal to verify the steps are executable."
  ],
  "evidence_refs": [
    "e5cc6880-e9b5-436c-94e6-6d97cf913dc1@frame:0001:ocr",
    "cf57a72a-968a-4b2d-8cf3-c7a8543a40af@frame:0002:ocr"
  ],
  "confidence": 0.63,
  "version": "0.1.0",
  "summary": "krvce JegrMed 'mpon shanghr Mt1an h1overrea0trarc",
  "tags": [
    "incident_response",
    "video",
    "build_skill",
    "heuristic"
  ],
  "review_status": "draft",
  "created_at": "2026-04-19T14:17:36Z",
  "skill_id": "265f1da8-0a28-4cea-a975-bc3f2233dd71"
}
