{
  "name": "audio transcript",
  "goal": "Distill ops material into a build_skill for self. Seed: Rebuild the incident timeline before proposing a root cause.",
  "source_modality": "audio",
  "skill_type": "procedure",
  "audience": "self",
  "trigger": [
    "Use when you need to convert audio evidence into a reusable build_skill."
  ],
  "inputs": [
    "Audio source or transcript",
    "Distillation goal"
  ],
  "preconditions": [
    "Rebuild the incident timeline before proposing a root cause."
  ],
  "steps": [
    {
      "step": 1,
      "action": "Rebuild the incident timeline before proposing a root cause.",
      "why": "Derived from normalized evidence and intended to preserve the original reasoning chain."
    },
    {
      "step": 2,
      "action": "If multiple alerts point to the same dependency, merge them into one incident stream.",
      "why": "Derived from normalized evidence and intended to preserve the original reasoning chain."
    },
    {
      "step": 3,
      "action": "Avoid changing configuration, code, and infrastructure in one mitigation step.",
      "why": "Derived from normalized evidence and intended to preserve the original reasoning chain."
    }
  ],
  "decision_rules": [
    "If multiple alerts point to the same dependency, merge them into one incident stream."
  ],
  "anti_patterns": [
    "Avoid changing configuration, code, and infrastructure in one mitigation step."
  ],
  "verification": [
    "Verify recovery with latency, saturation, and error rate instead of a single metric."
  ],
  "evidence_refs": [
    "b8b17793-7216-4a53-a56f-a9f76d49a397@timestamp:1.00-5.00",
    "7ed062ff-cf8a-40b5-8d8e-b4399146a2fb@timestamp:6.00-11.00",
    "17fc270e-f331-4761-8dad-72b891d18af4@timestamp:12.00-16.00",
    "795b0e75-5528-4e31-a366-319a4c13980c@timestamp:17.00-22.00"
  ],
  "confidence": 0.86,
  "version": "0.1.0",
  "summary": "Rebuild the incident timeline before proposing a root cause.",
  "tags": [
    "ops",
    "audio",
    "build_skill",
    "heuristic"
  ],
  "review_status": "draft",
  "created_at": "2026-04-19T13:52:07Z",
  "skill_id": "54f80baa-b8fb-4d2f-b2da-8a317dc5f9cb"
}
